<?xml version="1.0" encoding="windows-1251"?>
<payment-form name="PurchaseSaleCurrencyPayment" description="Покупка/продажа иностранной валюты"
              xmlns:xsi="http://www.w3.org/2001/XMLSchema-instance"
              xsi:noNamespaceSchemaLocation="../../PaymentForm.xsd">
	<implementation class="com.rssl.phizic.business.documents.InternalTransfer"/>
	<fields>
		<field
				name="documentNumber"
				description="Номер документа"
				type="string"
				source="document-number"
				signable="true">
		</field>
		<field name="state"
		       source="state"
		       description="Статус платежа"
			   type="string"/>
		<field
				name="documentDate"
				description="Дата документа"
				type="date"
				source="document-date"
				signable="true">

			<validators>
				<validator mode="document" class="com.rssl.common.forms.validators.RequiredFieldValidator"/>
				<validator class="com.rssl.common.forms.validators.DateFieldValidator"/>
				<validator class="com.rssl.common.forms.validators.DatePeriodFieldValidator">
					<message text="Дата документа должна быть не раньше текущей и не позже 10 дней – срока действия документа."/>
					<parameter name="after">10</parameter>
				</validator>
			</validators>
		</field>

		<field name="admissionDate"
		       source="admissionDate"
			   type="date"
		       description="Дата приема плaтежа банком">
			<validators>
				<validator class="com.rssl.common.forms.validators.DateFieldValidator"/>
			</validators>
		</field>

		<field
				name="payerAccountSelect"
				description="Счет списания"
				type="account"
				source="payer-account"
				signable="true">

			<validators>
				<validator mode="document" class="com.rssl.common.forms.validators.RequiredFieldValidator"/>
				<validator class="com.rssl.phizic.business.payments.forms.validators.AccountIsOpenValidator"/>
			</validators>
		</field>

		<field
				name="receiverAccountSelect"
				description="Счет зачисления"
				type="account"
				source="receiver-account"
				signable="true">

			<validators>
				<validator mode="document" class="com.rssl.common.forms.validators.RequiredFieldValidator"/>
				<validator class="com.rssl.phizic.business.payments.forms.validators.AccountIsOpenValidator"/>
			</validators>
		</field>

		<field
				name="foreignCurrencyAmount"
				description="Сумма"
				source="foreign-amount"
				type="money"
				signable="true">

			<validators>
				<validator class="com.rssl.common.forms.validators.MoneyFieldValidator">
					<message
							text="Значение суммы в иностранной валюте должно быть в диапазоне 0,01 - 999999999,99"/>
				</validator>
				<validator class="com.rssl.common.forms.validators.NumericRangeValidator">
					<message text="Значение суммы в иностранной валюте должно быть в диапазоне 0,01 - 999999999,99"/>
					<parameter name="minValue">0.01</parameter>
					<parameter name="maxValue">999999999.99</parameter>
				</validator>
				<validator mode="document" class="com.rssl.common.forms.validators.RequiredFieldValidator"/>
			</validators>
		</field>

		<field
				name="foreignCurrency"
				description="Иностранная валюта"
				source="extra-parameters/parameter[@name='foreign-currency']/@value"
				type="string"
				signable="true"/>

		<field
				name="rurCurrency"
				description="RUB"
				source="extra-parameters/parameter[@name='rur-currency']/@value"
				type="string"
				signable="true"/>

        <!--заполнил ли пользователь сумму списания (type=1) или сумму зачисления (type=2) в форме конверсии валюты
        эквивалентно: покупке валюты пользователем, если type=2, и продаже валюты пользователем, если type=1-->
		<field name="type"
		       source="extra-parameters/parameter[@name='type']/@value"
		       description="тип заполняемого поля"
			   type="string"/>

		<field
				name="rurAmount"
				description="Сумма в рублях"
				source="extra-parameters/parameter[@name='rur-amount']/@value"
				type="money"
				signable="true"/>

		<field
				name="course"
				description="Курс покупки/продажи"
				source="extra-parameters/parameter[@name='course']/@value"
				signable="true"/>

	</fields>

	<form-validators>
		<form-validator
				class="com.rssl.phizic.business.payments.forms.validators.ForeignAccountCurrencyPerfectValidator">
			<message text="Валюта счета не совпадает с выбранным видом валюты"/>
			<field-ref name="payerAccount">payerAccountSelect</field-ref>
			<field-ref name="receiverAccount">receiverAccountSelect</field-ref>
			<field-ref name="foreignCurrency">foreignCurrency</field-ref>
			<field-ref name="type">type</field-ref>
		</form-validator>
		<form-validator class="com.rssl.phizic.business.claims.forms.validators.EqualToOneFromParametersValidator">
			<message text="Указан неправильный тип открываемого счета"/>
			<field-ref name="parameterName">foreignCurrency</field-ref>
			<parameter name="param1">USD</parameter>
			<parameter name="param2">EUR</parameter>
		</form-validator>
	</form-validators>
</payment-form>
