<?xml version="1.0" encoding="windows-1251"?>
<payment-form name="DelayInvoiceSubscriptionClaim" description="Приостановка подписки"
              confirmDescription="Подписка успешно приостановлена."
              xmlns:xsi="http://www.w3.org/2001/XMLSchema-instance"
              xsi:noNamespaceSchemaLocation="../../PaymentForm.xsd">
	<implementation class="com.rssl.phizic.business.documents.payments.DelayInvoiceSubscriptionClaim"/>
	<statemachine name="DelayInvoiceSubscriptionClaim"/>
    <extended-metadata-loader class="com.rssl.phizic.business.payments.forms.meta.basket.CreateInvoiceSubscriptionClaimMetadataLoader"/>
    <fields>
        <field name="nameService"
               description="Наименование услуги в биллинговой системе"
               type="string"
               source="extra-parameters/parameter[@name='nameService']/@value"/>

        <field name="billingCode"
               description="Идентфикатор билинговой системы"
               type="string"
               source="extra-parameters/parameter[@name='provider-billing-code']/@value"/>

        <field name="receiverName"
               description="Наименование получателя"
               type="string"
               source="receiver-name"
               signable="true"/>

        <field name="subscriptionName"
               source="extra-parameters/parameter[@name='subscription-name']/@value"
               type="string"
               description="Наименование подписки"/>

        <field name="subscriptionId"
               source="extra-parameters/parameter[@name='invoice-sub-id']/@value"
               type="string"
               description="Идентификатор подписки"/>

        <field name="state"
               source="state"
               description="Статус платежа"
               type="string"/>

        <field name="autoSubNumber"
               source="extra-parameters/parameter[@name='long-offer-number']/@value"
               description="Номер платежа"
               type="string"/>

        <field name="fromAccountSelect"
               description="Счет/карта списания"
               type="string"
               source="payer-account"/>

        <field name="fromAccountName"
               source="extra-parameters/parameter[@name='from-account-name']/@value"
               description="Наименование источника списания"
               type="string"/>

        <field name="fromResourceCurrency"
               description="Валюта"
               source="extra-parameters/parameter[@name='from-resource-currency']/@value"
               type="string"/>

        <field name="fromResourceRest"
               source="extra-parameters/parameter[@name='from-resource-rest']/@value"
               description="Остаток на счете списания"
               type="string"/>

        <field name="groupName"
               description="Наименование группы услуг"
               source="extra-parameters/parameter[@name='group-name']/@value"
               type="string"/>

        <field name="invoiceAccountName"
               description="Название выставляемого счета"
               source="extra-parameters/parameter[@name='invoice-account-name']/@value"
               type="string"/>

        <field name="invoiceInfo"
               description="Информация о выставлениии счета по данной услуге"
               source="extra-parameters/parameter[@name='invoice-info']/@value"
               type="string"/>
    </fields>
</payment-form>